{
  "$schema": "https://json-schema.org/draft/2020-12/schema",
  "title": "StatiBaker Day State",
  "type": "object",
  "required": ["date", "day_state", "human_energy", "priorities"],
  "properties": {
    "date": {"type": "string", "format": "date"},
    "day_state": {"type": "string", "enum": ["active", "recovering", "travel", "offline"]},
    "human_energy": {"type": "string", "enum": ["low", "medium", "high"]},
    "constraints": {"type": "array", "items": {"type": "string"}},
    "alerts": {"type": "array", "items": {"type": "string"}},
    "priorities": {
      "type": "array",
      "minItems": 1,
      "maxItems": 5,
      "items": {"type": "string"}
    },
    "open_questions": {"type": "array", "items": {"type": "string"}},
    "blocked_tasks": {"type": "array", "items": {"type": "string"}},
    "labels": {"type": "array", "items": {"type": "string"}},
    "carryover_threads": {"type": "array", "items": {"type": "string"}},
    "carryover_new_threads": {"type": "array", "items": {"type": "string"}},
    "carryover_resolved_threads": {"type": "array", "items": {"type": "string"}},
    "carryover_age_days": {
      "type": "object",
      "additionalProperties": {"type": "integer", "minimum": 0}
    },
    "carryover_window_counts": {
      "type": "array",
      "items": {
        "type": "object",
        "required": ["window_days", "count"],
        "properties": {
          "window_days": {"type": "integer", "minimum": 1},
          "count": {"type": "integer", "minimum": 0}
        },
        "additionalProperties": false
      }
    },
    "agent_actions": {"type": "array", "items": {"type": "string"}},
    "agent_permissions": {
      "type": "object",
      "properties": {
        "autonomous_runs": {"type": "boolean"},
        "write_actions": {"type": "boolean"}
      },
      "required": ["autonomous_runs", "write_actions"],
      "additionalProperties": false
    },
    "sources": {
      "type": "array",
      "items": {
        "type": "object",
        "required": ["kind", "uri"],
        "properties": {
          "kind": {"type": "string"},
          "uri": {"type": "string"}
        },
        "additionalProperties": false
      }
    },
    "events": {
      "type": "array",
      "items": {
        "type": "object",
        "required": ["id", "ts", "source", "type", "text"],
        "properties": {
          "id": {"type": "string"},
          "ts": {"type": "string", "format": "date-time"},
          "source": {"type": "string"},
          "type": {"type": "string"},
          "text": {"type": "string"},
          "thread_id": {"type": "string"},
          "severity": {"type": "string", "enum": ["info", "warn", "error"]},
          "low_signal": {"type": "boolean"},
          "collapsed_count": {"type": "integer", "minimum": 1},
          "collapsed_ids": {"type": "array", "items": {"type": "string"}},
          "meta": {"type": "object"}
        },
        "additionalProperties": false
      }
    },
    "snapshots": {
      "type": "array",
      "items": {
        "type": "object",
        "required": ["id", "ts", "capture_kind", "payload_ref"],
        "properties": {
          "id": {"type": "string"},
          "ts": {"type": "string", "format": "date-time"},
          "capture_kind": {"type": "string"},
          "payload_ref": {"type": "string"},
          "app_id": {"type": "string"},
          "window_title": {"type": "string"},
          "display_id": {"type": "string"},
          "hash": {"type": "string"},
          "policy_flags": {"type": "array", "items": {"type": "string"}},
          "redacted": {"type": "boolean"}
        },
        "additionalProperties": false
      }
    },
    "activity_events": {
      "type": "array",
      "items": {
        "type": "object",
        "required": ["id", "t_start", "t_end", "snapshot_ids"],
        "properties": {
          "id": {"type": "string"},
          "t_start": {"type": "string", "format": "date-time"},
          "t_end": {"type": "string", "format": "date-time"},
          "snapshot_ids": {"type": "array", "minItems": 1, "items": {"type": "string"}},
          "primary_app": {"type": "string"},
          "title": {"type": "string"},
          "key_text": {"type": "array", "items": {"type": "string"}},
          "thumb_snapshot_id": {"type": "string"},
          "confidence": {"type": "number", "minimum": 0, "maximum": 1},
          "policy_flags": {"type": "array", "items": {"type": "string"}},
          "derived_from": {"type": "array", "items": {"type": "string"}}
        },
        "additionalProperties": false
      }
    },
    "threads": {
      "type": "array",
      "items": {
        "type": "object",
        "required": ["id", "title", "status"],
        "properties": {
          "id": {"type": "string"},
          "title": {"type": "string"},
          "status": {"type": "string", "enum": ["active", "blocked", "paused", "done"]},
          "last_event_ts": {"type": "string", "format": "date-time"},
          "tags": {"type": "array", "items": {"type": "string"}}
        },
        "additionalProperties": false
      }
    },
    "retrospective": {
      "type": "object",
      "properties": {
        "completed": {"type": "array", "items": {"type": "string"}},
        "partial": {"type": "array", "items": {"type": "string"}},
        "missed": {"type": "array", "items": {"type": "string"}},
        "drift_signals": {"type": "array", "items": {"type": "string"}},
        "tomorrow_setup": {"type": "array", "items": {"type": "string"}}
      },
      "additionalProperties": false
    }
    ,
    "compression": {
      "type": "object",
      "properties": {
        "loss_profiles": {
          "type": "array",
          "items": {
            "type": "object",
            "required": ["kind"],
            "properties": {
              "kind": {"type": "string"},
              "details": {"type": "object"}
            },
            "additionalProperties": false
          }
        }
      },
      "additionalProperties": false
    }
  },
  "additionalProperties": false
}
