{
  "agent_actions": [],
  "agent_permissions": {
    "autonomous_runs": false,
    "write_actions": false
  },
  "alerts": [],
  "blocked_tasks": [],
  "carryover_age_days": {},
  "carryover_new_threads": [],
  "carryover_resolved_threads": [],
  "carryover_threads": [],
  "carryover_window_counts": [
    {
      "count": 0,
      "window_days": 7
    },
    {
      "count": 0,
      "window_days": 14
    },
    {
      "count": 0,
      "window_days": 30
    }
  ],
  "compression": {
    "loss_profiles": []
  },
  "constraints": [],
  "date": "2026-02-08",
  "day_state": "active",
  "events": [
    {
      "id": "signal-4c077625fabc",
      "meta": {
        "event_type": "pr_received",
        "signal": "pr_event"
      },
      "source": "observed",
      "text": "signal=pr_event, event_type=pr_received",
      "ts": "2026-02-08T06:12:10Z",
      "type": "signal"
    },
    {
      "id": "signal-ac8dcb1fb0de",
      "meta": {
        "event_type": "pr_commented",
        "signal": "pr_event"
      },
      "source": "observed",
      "text": "signal=pr_event, event_type=pr_commented",
      "ts": "2026-02-08T06:13:10Z",
      "type": "signal"
    },
    {
      "id": "signal-418c9fb31a3c",
      "meta": {
        "event_type": "pr_merged",
        "signal": "pr_event"
      },
      "source": "observed",
      "text": "signal=pr_event, event_type=pr_merged",
      "ts": "2026-02-08T06:14:10Z",
      "type": "signal"
    }
  ],
  "human_energy": "medium",
  "labels": [],
  "open_questions": [],
  "priorities": [
    "Review git activity",
    "Update SB outputs"
  ],
  "sources": [
    {
      "kind": "git",
      "uri": "/home/c/Documents/code/ITIR-suite/StatiBaker/runs/2026-02-08/logs/git/2026-02-08.jsonl"
    }
  ]
}